{
  "title": "FR SB Push/Fold 10BB 10% Ante",
  "author": "Hold'em Tools",
  "combos": {"22":[0,1],"33":[0,1],"44":[0,1],"55":[0,1],"66":[0,1],"77":[0,1],"88":[0,1],"99":[0,1],"AA":[0,1],"AKs":[0,1],"AQs":[0,1],"AJs":[0,1],"ATs":[0,1],"AKo":[0,1],"AQo":[0,1],"KK":[0,1],"QQ":[0,1],"JJ":[0,1],"TT":[0,1],"KQs":[0,1],"KJs":[0,1],"QJs":[0,1],"KTs":[0,1],"QTs":[0,1],"JTs":[0,1],"A9s":[0,1],"K9s":[0,1],"AJo":[0,1],"KQo":[0,1],"A8s":[0,1],"A7s":[0,1],"A6s":[0,1],"A5s":[0,1],"A4s":[0,1],"Q9s":[0,1],"J9s":[0,1],"T9s":[0,1],"ATo":[0,1],"A3s":[0,1],"A2s":[0,1],"K8s":[0,1],"K7s":[0,1],"98s":[0,1],"A9o":[0,1],"A8o":[0,1],"A7o":[0,1],"A5o":[0,1],"KJo":[0,1],"KTo":[0,1],"QJo":[0,1],"K6s":[0,1],"K5s":[0,1],"Q8s":[0,1],"J8s":[0,1],"T8s":[0,1],"A6o":[0,1],"A4o":[0,1],"QTo":[0,1],"JTo":[0,1],"A3o":[0,1],"A2o":[0,1],"K4s":[0,1],"87s":[0,1],"K9o":[0,1],"K3s":[0,1],"K2s":[0,1],"Q7s":[0,1],"Q6s":[0,1],"J7s":[0,1],"97s":[0,1],"K8o":[0,1],"K7o":[0,1],"Q9o":[0,1],"Q5s":[0,1],"Q4s":[0,1],"T7s":[0,1],"76s":[0,1],"K6o":[0,1],"K5o":[0,1],"J9o":[0,1],"T9o":[0,1],"K4o":[0,1],"K3o":[0,1],"K2o":[0,1],"Q8o":[0,1],"Q7o":[0,1],"Q6o":[0,1],"J8o":[0,1],"T8o":[0,1],"98o":[0,1],"86s":[0,1],"96s":[0,1],"T6s":[0,1],"J6s":[0,1],"J5s":[0,1],"J4s":[0,1],"Q3s":[0,1],"Q2s":[0,1],"Q5o":[0,1],"Q4o":[0,1],"Q3o":[0,1],"Q2o":[0,1],"J5o":[0,1],"J6o":[0,1],"J7o":[0,1],"T7o":[0,1],"97o":[0,1],"96o":[0,1],"87o":[0,1],"86o":[0,1],"76o":[0,1],"J2s":[0,1],"93s":[0,1],"T2s":[0,1],"T3s":[0,1],"J3s":[0,1],"T4s":[0,1],"T5s":[0,1],"95s":[0,1],"94s":[0,1],"85s":[0,1],"84s":[0,1],"75s":[0,1],"74s":[0,1],"63s":[0,1],"64s":[0,1],"65s":[0,1],"65o":[0,1],"54s":[0,1],"53s":[0,1],"43s":[0,1]},
  "actions": [
    {
      "name": "Fold",
      "color": "#d3d3d3"
    },
    {
      "name": "Push",
      "color": "#7ec78e"
    }
  ],
  "_id": "CEXsrQss5OGFfKsFuuua2"
}
