{
  "_id": "GDd2WpgGyJVyEat2fASqX",
  "actions": [
    {
      "name": "Fold",
      "color": "#d3d3d3"
    },
    {
        "name": "Raise/Call/Jam vs 3 Bet",
        "color": "#06ce0c"
    },
    {
        "name": "Call vs 3 Bet",
        "color": "#d9e90e"
    },
    {
        "name": "Fold vs 3 Bet",
        "color": "#fd6363"
    },
    {
        "name": "Call 3 Bet vs BTN",
        "color": "#1b9af7"
    },
    {
        "name": "4 Bet vs 3 Bet",
        "color": "#bb63fd"
    }
  ],
  "author": "Hold'em Poker Tools",
  "combos": {"33":[0,0,0,1,0,0],"44":[0,0,1,0,0,0],"55":[0,0,1,0,0,0],"66":[0,1,0,0,0,0],"77":[0,1,0,0,0,0],"88":[0,1,0,0,0,0],"99":[0,1,0,0,0,0],"AA":[0,1,0,0,0,0],"KK":[0,1,0,0,0,0],"QQ":[0,1,0,0,0,0],"JJ":[0,1,0,0,0,0],"TT":[0,1,0,0,0,0],"AKs":[0,1,0,0,0,0],"AQs":[0,1,0,0,0,0],"AKo":[0,1,0,0,0,0],"AQo":[0,1,0,0,0,0],"AJs":[0,1,0,0,0,0],"ATs":[0,0,1,0,0,0],"KQs":[0,1,0,0,0,0],"KJs":[0,0,1,0,0,0],"KTs":[0,0,1,0,0,0],"QJs":[0,0,1,0,0,0],"A5s":[0,0,1,0,0,1],"A4s":[0,0,1,0,0,1],"A7s":[0,0,1,0,0,0],"A6s":[0,0,1,0,0,0],"ATo":[0,0,1,0,0,0],"KJo":[0,0,1,0,0,0],"K8s":[0,0,1,0,0,0],"Q9s":[0,0,1,0,0,0],"QTs":[0,0,1,0,0,0],"JTs":[0,0,1,0,0,0],"A9s":[0,0,1,0,0,0],"A8s":[0,0,1,0,0,0],"A2s":[0,0,0,0,1,0],"K9s":[0,0,1,0,0,0],"K7s":[0,0,0,0,1,0],"T8s":[0,0,0,1,0,0],"T9s":[0,0,1,0,0,0],"KTo":[0,0,0,1,0,0],"QJo":[0,0,0,1,0,0],"AJo":[0,1,0,0,0,0],"K6s":[0,0,0,0,1,0],"K5s":[0,0,0,0,1,0],"97s":[0,0,0,1,0,0],"A9o":[0,0,0,1,0,0],"J8s":[0,0,0,1,0,0],"Q8s":[0,0,0,0,1,0],"Q6s":[0,0,0,1,0,0],"Q7s":[0,0,0,1,0,0],"J7s":[0,0,0,1,0,0],"T7s":[0,0,0,1,0,0],"86s":[0,0,0,1,0,0],"A8o":[0,0,0,1,0,0],"QTo":[0,0,0,1,0,0],"JTo":[0,0,0,1,0,0],"KQo":[0,0,1,0,0,0],"A7o":[0,0,0,1,0,0],"A6o":[0,0,0,1,0,0],"A5o":[0,0,0,1,0,0],"K9o":[0,0,0,1,0,0],"Q9o":[0,0,0,1,0,0],"J9o":[0,0,0,1,0,0],"T9o":[0,0,0,1,0,0],"J9s":[0,0,0,0,1,0],"98s":[0,0,0,0,1,0],"87s":[0,0,0,0,1,0],"76s":[0,0,0,0,1,0],"96s":[0,0,0,1,0,0],"T6s":[0,0,0,1,0,0],"J6s":[0,0,0,1,0,0],"Q5s":[0,0,0,1,0,0],"Q4s":[0,0,0,1,0,0],"K4s":[0,0,0,1,0,0],"K3s":[0,0,0,1,0,0],"K2s":[0,0,0,1,0,0],"A3s":[0,0,1,0,0,0],"75s":[0,0,0,1,0,0],"65s":[0,0,0,1,0,0],"54s":[0,0,0,1,0,0]},
  "title": "RFI FR CO 30BB"
}
