{
  "_id": "12345678901234",
  "actions": [
    {
      "color": "#d3d3d3",
      "name": "Fold"
    },
    {
      "color": "#efe819",
      "name": "Call"
    },
    {
      "color": "#06ce0c",
      "name": "Raise 2BB-3BB"
    },
    {
      "color": "#bb63fd",
      "name": "Raise 4BB-6BB"
    }
  ],
  "author": "Hold'em Tools",
  "combos": {
    "55": [75, 0, 25, 0],
    "66": [50, 0, 50, 0],
    "77": [0, 0, 100, 0],
    "88": [0, 0, 100, 0],
    "99": [0, 0, 100, 0],
    "A5s": [25, 0, 75, 0],
    "A9s": [75, 0, 25, 0],
    "AA": [0, 5, 30, 65],
    "AJo": [0, 0, 100, 0],
    "AJs": [0, 0, 70, 30],
    "AKo": [0, 0, 65, 35],
    "AKs": [0, 0, 35, 65],
    "AQo": [0, 0, 90, 10],
    "AQs": [0, 0, 50, 50],
    "ATo": [75, 0, 25, 0],
    "ATs": [0, 0, 100, 0],
    "JJ": [0, 0, 35, 65],
    "JTs": [0, 0, 100, 0],
    "KJs": [0, 0, 100, 0],
    "KK": [0, 5, 30, 65],
    "KQo": [0, 0, 100, 0],
    "KQs": [0, 0, 100, 0],
    "KTs": [50, 0, 50, 0],
    "QJs": [0, 0, 100, 0],
    "QQ": [0, 5, 30, 65],
    "QTs": [50, 0, 50, 0],
    "TT": [0, 0, 50, 60]
  },
  "title": "FR Cash MP RFI"
}
