{
  "title": "FR UTG2 Push/Fold 20BB 10% Ante",
  "author": "Hold'em Tools",
  "combos": {"55":[0,1],"66":[0,1],"77":[0,1],"88":[0,1],"99":[0,1],"AA":[0,1],"AKs":[0,1],"AQs":[0,1],"AJs":[0,1],"ATs":[0,1],"AKo":[0,1],"AQo":[0,1],"KK":[0,1],"QQ":[0,1],"JJ":[0,1],"TT":[0,1],"KQs":[0,1],"KJs":[0,1],"QJs":[0,1],"KTs":[0,1],"QTs":[0,1],"JTs":[0,1],"A9s":[0,1],"A5s":[0,1],"A4s":[0,1]},
  "actions": [
    {
      "name": "Fold",
      "color": "#d3d3d3"
    },
    {
      "name": "Push",
      "color": "#7ec78e"
    }
  ],
  "_id": "hruIKdwYHujEH5c1PGF54"
}
