{
  "_id": "7d28tXbQgsgPD47YhOWiC",
  "actions": [
    {
      "name": "Fold",
      "color": "#d3d3d3",
      "inRange": false
    },
    {
        "name": "Raise/Call/Jam vs 3 Bet",
        "color": "#06ce0c",
        "inRange": true
    },
    {
        "name": "Call vs 3 Bet",
        "color": "#d9e90e",
       "inRange": true
    },
    {
        "name": "Fold vs 3 Bet",
        "color": "#fd6363",
        "inRange": true
    }
  ],
  "author": "Hold'em Poker Tools",
  "combos": {
    "AA": [0, 1, 0, 0],
    "KK": [0, 1, 0, 0],
    "QQ": [0, 1, 0, 0],
    "JJ": [0, 1, 0, 0],
    "TT": [0, 1, 0, 0],
    "99": [0, 1, 0, 0],
    "AKs": [0, 1, 0, 0],
    "AQs": [0, 1, 0, 0],
    "AKo": [0, 1, 0, 0],
    "AQo": [0, 1, 0, 0],
    "AJs": [0, 0, 1, 0],
    "88": [0, 0, 1, 0],
    "77": [0, 0, 1, 0],
    "66": [0, 0, 1, 0],
    "ATs": [0, 0, 1, 0],
    "KQs": [0, 0, 1, 0],
    "KJs": [0, 0, 1, 0],
    "KTs": [0, 0, 1, 0],
    "QJs": [0, 0, 1, 0],
    "A5s": [0, 0, 1, 0],
    "A4s": [0, 0, 1, 0],
    "A3s": [0, 0, 1, 0],
    "A9s": [0, 0, 0, 1],
    "A8s": [0, 0, 0, 1],
    "A7s": [0, 0, 0, 1],
    "A6s": [0, 0, 0, 1],
    "A2s": [0, 0, 0, 1],
    "AJo": [0, 0, 0, 1],
    "ATo": [0, 0, 0, 1],
    "KQo": [0, 0, 0, 1],
    "KJo": [0, 0, 0, 1],
    "K9s": [0, 0, 0, 1],
    "Q9s": [0, 0, 0, 1],
    "QTs": [0, 0, 0, 1],
    "JTs": [0, 0, 0, 1],
    "J9s": [0, 0, 0, 1],
    "T9s": [0, 0, 0, 1]
  },
  "title": "RFI FR UTG 30BB"
}
